{
  "$schema": "MSM Quest Catalog Extract v2",
  "institution": {
    "id": "msm",
    "name": "Morehouse School of Medicine",
    "abbreviation": "MSM",
    "program": "Doctor of Medicine (MD)",
    "total_credits": 191.0,
    "accreditation": "LCME",
    "tracks": ["4-Year Standard", "5-Year Decelerated"],
    "learning_outcome_domains": [
      "Medical Knowledge",
      "Clinical Skills",
      "Professional Attributes"
    ]
  },

  "programs": [
    {
      "id": "msm_md",
      "name": "Doctor of Medicine",
      "degree": "MD",
      "total_credits": 191.0,
      "academic_years": [
        {
          "id": "msm_m1",
          "name": "M1",
          "year_number": 1,
          "type": "preclinical",
          "total_credits": 51.0,
          "theme": "Normal Structure & Function",
          "phases": [
            {
              "id": "msm_phase_bp",
              "name": "Basic Principles",
              "abbreviation": "BP",
              "months": "July-September",
              "order": 1,
              "blocks": [
                {
                  "id": "msm_block_bp",
                  "name": "Basic Principles Block",
                  "courses": [
                    {
                      "id": "msm_medi_530",
                      "code": "MEDI 530",
                      "name": "Basic Principles",
                      "course_type": "integrated_organ_system",
                      "credit_hours": 10.0,
                      "description": "Integrated course covering anatomy, biochemistry, cell biology, genetics, embryology, and physiology as foundational sciences.",
                      "grading": "letter",
                      "required": true,
                      "usmle_systems": ["General Principles", "Immune System", "Blood & Lymphoreticular"],
                      "ilos": [],
                      "curriculum_units": [
                        { "id": "cu_gross_anatomy", "name": "Gross Anatomy", "order": 1, "usmle_systems": ["General Principles"] },
                        { "id": "cu_biochemistry", "name": "Biochemistry", "order": 2, "usmle_systems": ["General Principles"] },
                        { "id": "cu_cell_biology", "name": "Cell Biology", "order": 3, "usmle_systems": ["General Principles"] },
                        { "id": "cu_genetics", "name": "Genetics", "order": 4, "usmle_systems": ["General Principles"] },
                        { "id": "cu_embryology", "name": "Embryology", "order": 5, "usmle_systems": ["General Principles"] },
                        { "id": "cu_physiology", "name": "Physiology", "order": 6, "usmle_systems": ["General Principles"] }
                      ]
                    }
                  ]
                }
              ]
            },
            {
              "id": "msm_phase_os1",
              "name": "Organ Systems 1",
              "abbreviation": "OS1",
              "months": "September-November",
              "order": 2,
              "blocks": [
                {
                  "id": "msm_block_os1",
                  "name": "Organ Systems 1 Block",
                  "courses": [
                    {
                      "id": "msm_medi_531",
                      "code": "MEDI 531",
                      "name": "Organ Systems 1",
                      "course_type": "integrated_organ_system",
                      "credit_hours": 10.0,
                      "description": "Integrated systems-based course covering cardiovascular, respiratory, and renal systems.",
                      "grading": "letter",
                      "required": true,
                      "usmle_systems": ["Cardiovascular", "Respiratory", "Renal & Urinary"],
                      "ilos": [],
                      "curriculum_units": [
                        { "id": "cu_cardio", "name": "Cardiovascular", "order": 1, "usmle_systems": ["Cardiovascular System"] },
                        { "id": "cu_respiratory", "name": "Respiratory", "order": 2, "usmle_systems": ["Respiratory System"] },
                        { "id": "cu_renal", "name": "Renal", "order": 3, "usmle_systems": ["Renal & Urinary System"] }
                      ]
                    }
                  ]
                }
              ]
            },
            {
              "id": "msm_phase_os2",
              "name": "Organ Systems 2",
              "abbreviation": "OS2",
              "months": "January-February",
              "order": 3,
              "blocks": [
                {
                  "id": "msm_block_os2",
                  "name": "Organ Systems 2 Block",
                  "courses": [
                    {
                      "id": "msm_medi_532",
                      "code": "MEDI 532",
                      "name": "Organ Systems 2",
                      "course_type": "integrated_organ_system",
                      "credit_hours": 10.0,
                      "description": "Integrated systems-based course covering gastrointestinal, endocrine, and reproductive systems.",
                      "grading": "letter",
                      "required": true,
                      "usmle_systems": ["Gastrointestinal", "Endocrine", "Reproductive"],
                      "ilos": [],
                      "curriculum_units": [
                        { "id": "cu_gi", "name": "Gastrointestinal", "order": 1, "usmle_systems": ["Gastrointestinal System"] },
                        { "id": "cu_endocrine", "name": "Endocrine", "order": 2, "usmle_systems": ["Endocrine System"] },
                        { "id": "cu_reproductive", "name": "Reproductive", "order": 3, "usmle_systems": ["Reproductive System"] }
                      ]
                    }
                  ]
                }
              ]
            },
            {
              "id": "msm_phase_os3",
              "name": "Organ Systems 3",
              "abbreviation": "OS3",
              "months": "March-May",
              "order": 4,
              "blocks": [
                {
                  "id": "msm_block_os3",
                  "name": "Organ Systems 3 Block",
                  "courses": [
                    {
                      "id": "msm_medi_533",
                      "code": "MEDI 533",
                      "name": "Organ Systems 3",
                      "course_type": "integrated_organ_system",
                      "credit_hours": 10.0,
                      "description": "Integrated systems-based course covering musculoskeletal, nervous system, and special senses.",
                      "grading": "letter",
                      "required": true,
                      "usmle_systems": ["Musculoskeletal, Skin & Subcutaneous Tissue", "Nervous System & Special Senses"],
                      "ilos": [],
                      "curriculum_units": [
                        { "id": "cu_msk", "name": "Musculoskeletal", "order": 1, "usmle_systems": ["Musculoskeletal, Skin & Subcutaneous Tissue"] },
                        { "id": "cu_neuro", "name": "Nervous System", "order": 2, "usmle_systems": ["Nervous System & Special Senses"] }
                      ]
                    }
                  ]
                }
              ]
            }
          ],
          "longitudinal_courses": [
            {
              "id": "msm_medi_509",
              "code": "MEDI 509",
              "name": "Community Health",
              "course_type": "longitudinal",
              "credit_hours": 4.0,
              "duration_weeks": 48,
              "description": "Longitudinal course addressing community health, population health, health disparities, and social determinants of health.",
              "grading": "letter",
              "required": true,
              "usmle_systems": ["Social Sciences"],
              "ilos": [],
              "curriculum_units": []
            },
            {
              "id": "msm_medi_511",
              "code": "MEDI 511",
              "name": "Fundamentals of Medicine 1",
              "course_type": "longitudinal",
              "credit_hours": 7.0,
              "duration_weeks": 48,
              "description": "Longitudinal course introducing clinical skills, history taking, physical examination, and communication.",
              "grading": "pass_fail",
              "required": true,
              "usmle_systems": ["General Principles"],
              "ilos": [],
              "curriculum_units": []
            }
          ]
        },
        {
          "id": "msm_m2",
          "name": "M2",
          "year_number": 2,
          "type": "preclinical",
          "total_credits": 42.0,
          "theme": "Abnormal Structure & Function",
          "phases": [
            {
              "id": "msm_phase_m2",
              "name": "M2 Discipline-Based",
              "abbreviation": "M2",
              "months": "July-May",
              "order": 1,
              "blocks": [
                {
                  "id": "msm_block_m2",
                  "name": "M2 Block",
                  "courses": [
                    {
                      "id": "msm_medi_600",
                      "code": "MEDI 600",
                      "name": "Pathophysiology",
                      "course_type": "discipline_based",
                      "credit_hours": 7.0,
                      "description": "Disease mechanisms and clinical correlations integrating basic science with clinical pathology.",
                      "grading": "letter",
                      "required": true,
                      "usmle_systems": ["General Principles", "Multisystem Processes & Disorders"],
                      "ilos": [],
                      "curriculum_units": []
                    },
                    {
                      "id": "msm_medi_602",
                      "code": "MEDI 602",
                      "name": "Microbiology and Immunology",
                      "course_type": "discipline_based",